[
    {
      "id": 1,
      "title": "HOA Board Meeting – March 2026",
      "date": "2026-03-10",
      "summary": "Summary of decisions made during the March board meeting.",
      "link": "docs/HOA_Announcement_Template.pdf"
    },
    {
      "id": 2,
      "title": "Pool Maintenance Notice",
      "date": "2026-02-22",
      "summary": "Pool will be closed for maintenance Feb 25–27."
    },
    {
        "id": 2,
        "title": "Pool Maintenance Notice",
        "date": "2026-02-22",
        "summary": "Pool will be closed for maintenance Feb 25–27."
    }
]
  